Sheet: sample
A1: Sample eXcel document
A2: Year | B2: Quantity
A3: 2018 | B3: 4
A4: 2019 | B4: 3
A5: 2020 | B5: 7
B6: of:=SUM([.B3:.B5]) -> 14

Sheet: shopping
A1: Item | B1: Qty | C1: Cost per item | D1: Subtotal
A2: Ice cream | B2: 4 | C2: 3.99 | D2: of:=[.B2]*[.C2] -> 15.96
A3: Beans | B3: 10 | C3: 0.5 | D3: of:=[.B3]*[.C3] -> 5
A4: Razors | B4: 2 | C4: 2.49 | D4: of:=[.B4]*[.C4] -> 4.98
A5: Bananas | B5: 3 | C5: 0.99 | D5: of:=[.B5]*[.C5] -> 2.97
A6: ἄρτος | B6: 3 | C6: 1.49 | D6: of:=[.B6]*[.C6] -> 4.47
D7: of:=[.B7]*[.C7] -> 0
D8: of:=[.B8]*[.C8] -> 0
D9: of:=[.B9]*[.C9] -> 0
D10: of:=SUM([.D2:.D9]) -> 33.38